{
  "resourceType": "DiagnosticReport",
  "identifier": [
    {
      "system": "urn:lab:laboratorio-simulado",
      "value": "LS-2026-000123"
    }
  ],
  "status": "final",
  "code": {
    "coding": [
      {
        "system": "http://www.saude.gov.br/fhir/r4/CodeSystem/BRTabelaSUS",
        "code": "0202020380",
        "display": "HEMOGRAMA COMPLETO"
      }
    ]
  },
  "basedOn": [
    {
      "identifier": {
        "value": "K7M2Q9XR4T"
      }
    }
  ],
  "subject": {
    "identifier": {
      "system": "http://rnds.saude.gov.br/fhir/r4/NamingSystem/cpf",
      "value": "52998224725"
    }
  },
  "issued": "2026-10-13T14:05:00-03:00",
  "performer": [
    {
      "display": "Laboratório Simulado"
    }
  ],
  "presentedForm": [
    {
      "contentType": "application/pdf",
      "data": "JVBERi0xLjQKJcOkw7zDtsOfCjEgMCBvYmoKPDw+PgplbmRvYmoKdHJhaWxlcgo8PC9Sb290IDEgMCBSPj4KJSVFT0YK"
    }
  ],
  "result": [
    {
      "reference": "#hb"
    },
    {
      "reference": "#plt"
    }
  ],
  "contained": [
    {
      "resourceType": "Observation",
      "id": "hb",
      "status": "final",
      "code": {
        "coding": [
          {
            "system": "http://loinc.org",
            "code": "718-7",
            "display": "Hemoglobin [Mass/volume] in Blood"
          }
        ]
      },
      "valueQuantity": {
        "value": 13.4,
        "unit": "g/dL"
      }
    },
    {
      "resourceType": "Observation",
      "id": "plt",
      "status": "final",
      "code": {
        "coding": [
          {
            "system": "http://loinc.org",
            "code": "777-3",
            "display": "Platelets [#/volume] in Blood"
          }
        ]
      },
      "valueQuantity": {
        "value": 41,
        "unit": "10*3/uL"
      },
      "interpretation": [
        {
          "coding": [
            {
              "system": "http://terminology.hl7.org/CodeSystem/v3-ObservationInterpretation",
              "code": "LL"
            }
          ]
        }
      ]
    }
  ]
}
